{
  "$schema": "https://json-schema.org/draft/2020-12/schema",
  "title": "Authority origin receipt",
  "type": "object",
  "required": [
    "schema_version",
    "crate",
    "touchpoint",
    "authority_kind",
    "origin_kind",
    "profile",
    "status"
  ],
  "properties": {
    "schema_version": {
      "type": "string"
    },
    "crate": {
      "type": "string"
    },
    "touchpoint": {
      "type": "string"
    },
    "authority_kind": {
      "type": "string"
    },
    "origin_kind": {
      "type": "string"
    },
    "profile": {
      "type": "string"
    },
    "status": {
      "type": "string"
    },
    "notes": {
      "type": "array",
      "items": {
        "type": "string"
      }
    }
  },
  "additionalProperties": true
}
