{
  "schema_version": "0.1",
  "crate": "example-cache-client",
  "touchpoint": "session_temp_dir",
  "authority_kind": "temp_dir",
  "origin_kind": "host_supplied_capability",
  "profile": "sandbox_ready",
  "status": "preferred_route_witnessed",
  "notes": [
    "profile constructs temporary data under caller Dir via cap_tempfile::tempdir_in",
    "ambient tempdir route is forbidden_in_profile"
  ]
}
